{
  "$schema": "./schema/operator.schema.json",
  "schemaVersion": 1,
  "proxmoxHost": "192.0.2.10",
  "proxmoxNode": "pve01",
  "sshUser": "root",
  "sshPrivateKeyPath": "/home/operator/.ssh/id_ed25519",
  "media": {
    "server2025": {
      "volume": "local:iso/windows-server-2025.iso",
      "sha256": "0000000000000000000000000000000000000000000000000000000000000000"
    },
    "windows11": {
      "volume": "local:iso/windows-11.iso",
      "sha256": "0000000000000000000000000000000000000000000000000000000000000000"
    }
  }
}
